MS-OR-00149,"The manuscript contains the unpublished Sekanirdeśapañjikā, a commentary by Rāmapāla (11th century) on the Sekanirṇaya (aka Sekanirdeśa) by the celebrated siddha Maitreyanātha (aka Advayavajra, Maitrīgupta and Maitrīpāda) (1007-1085). Rāmapāla was one of the four main disciples of Maitreyanātha . The title of the text could be translated into English as ""Commentary on the Explanation of Consecration."" The latter was written by Maitreyanātha in accord with the teachings of the Sequence of the Four Seals (Caturmudrānvaya) by a certain Nāgārjuna. The text starts with an explanation of the mystical word evam and its Tantric symbolism. Then it continues with an explanation of the four moments (kṣaṇa) and the related blisses (ānanda) that are to be experienced during the higher phase of the initiation. The text and in particular the commentary refer to a debate between different Buddhist traditions regarding the sequence of the blisses and the nature of their experience, and its significance. Rāmapāla quotes several stanzas from the Pramāṇavārttika by Dharmakīrti and many passages from other Mahāyānic and Tantric works (in particular from the Hevajratantra). In the mūla text we find stanzas even from early Śaiva sources. In Isaacson and Sferra’s forthcoming edition of the text this manuscript is referred to with the siglum Ca."," The manuscript contains the unpublished Sekanirdeśapañjikā, a commentary by Rāmapāla (11th century) on the Sekanirṇaya (aka",Sekanirdeśapañjikā,,,,,https://cudl.lib.cam.ac.uk/iiif/MS-OR-00149,palm_leaf,1100,1200,1000132,Nepal.,,san,,,,
MS-ADD-01706-00005,"A palm-leaf manuscript of the Lakṣaṇa, Piṇḍikālakṣaṇa.","A palm-leaf manuscript of the Lakṣaṇa, Piṇḍikālakṣaṇa.","Lakṣaṇa, Piṇḍikālakṣaṇa",,,,,https://cudl.lib.cam.ac.uk/iiif/MS-ADD-01706-00005,palm_leaf,,,,,nepālākṣarā,san,5,20,,
MS-ADD-01679-00006,A paper palm-leaf of an Avadāna.,A paper palm-leaf of an Avadāna.,Avadāna,,,,,https://cudl.lib.cam.ac.uk/iiif/MS-ADD-01679-00006,palm_leaf,,,,,nepālākṣarā,san,"4,5",23,,
MS-OR-00142-00001,"The Vasudhāradhāraṇī, dedicated to Vasudhārā, the bodhisattva of wealth, prosperity, and abundance (who has a strong following among the Newar Buddhists of the Kathmandu valley), is taught by the Buddha in Kauśāmbī to the rich merchant and layman Sucandra. He has been reduced to poverty and so requests a sermon from the Lord so that he may provide for his own family and so that all beings may become prosperous. This scripture includes a dhāraṇī along with enumerations of benefits and ritual instructions for use. This illuminated palm-leaf manuscript, dated 1123 CE and written under the reign of Śivadeva , is one of the earliest extant manuscripts of the Vasudhāradhāraṇī. According to the colophon, it was commissioned by a pious Buddhist layman, Rudākarasiṃha by name, as a meritorious gift (deyadharmo 'yaṃ pravaramahāyānayāyinaḥ paramopāsakarudākarasiṃhasya)."," The Vasudhāradhāraṇī, dedicated to Vasudhārā, the bodhisattva of wealth, prosperity, and abundance (who has a strong following",Vasudhārādhāraṇī,,,Vasudhārādhāraṇī,"Vasudhāraṇī,Vasudhārādhāraṇīsūtra",https://cudl.lib.cam.ac.uk/iiif/MS-OR-00142-00001,palm_leaf,,,1000132,Nepāl.,pāla,san,5,"27,5",,"2,2"
MS-ADD-01688,"The Pañcarakṣā corpus (""Five Protections"") consists of the Mahāpratisarā, Mahāmāyūrī, Mahāsāhasrapramardanī, Mahāmantrānusāriṇī, and Mahāśītavatī. The earliest evidence for texts grouped together as the ""Five Great Dhāraṇīs"" comes from Tibetan catalogues around 800 CE, but this compendium is somewhat different from the surviving Sanskrit collection, which is preserved in manuscripts dating back to the eleventh century. These scriptures include spells, enumerations of benefits and ritual instructions for use. With the course of time all of them became deified and five related goddesses emerged. It is, however, important to note that the texts themselves do not have any references to these goddesses. This Bengalese manuscript, dated to the second half of the 11th century and commissioned by the queen Ḍaddākā (probably the same as the Lāḍākā mentioned in Add.1464), is one of the oldest known examples of such a collection and is decorated with a series of thirty-six refined miniatures."," The Pañcarakṣā corpus (""Five Protections"") consists of the Mahāpratisarā, Mahāmāyūrī, Mahāsāhasrapramardanī, Mahāmantrānusāriṇī,",Pañcarakṣā,T1946,,,,https://cudl.lib.cam.ac.uk/iiif/MS-ADD-01688,palm_leaf,,,7016617,Bengal.,pāla,san,,,,
MS-ADD-01161,"An 11th century palm-leaf manuscripts of the Śiṣyalekha, a work belonging to the Buddhist epistolary genre (lekha). Composed by the Buddhist grammarian and poet Candragomin (5th century CE), it is a short ornate poem (kāvya) in the form of a letter containing an exposition of the Buddhist doctrine addressed to Candragomin's disciple Ratnakīrti, ""who had broken is monk's vow and was engaged in a love affair with a princess"" (Hahn 1998: liii). Edited twice, by I.P. Minaev in 1889 and by M. Hahn in 1998, it is considered by the latter as ""the most refined of the extant Buddhist epistles"" (Hahn 1998 li). The present manuscript was used by Hahn for his edition (in which it was given the siglum A).","An 11th century palm-leaf manuscripts of the Śiṣyalekha, a work belonging to the Buddhist epistolary genre (lekha). Composed",Śiṣyalekha,,,Śiṣyalekha,Śiṣyalekhadharmakāvya,https://cudl.lib.cam.ac.uk/iiif/MS-ADD-01161,palm_leaf,,,1000132,Nepal.,nepālākṣarā,san,5,"30,5",,2
MS-OR-00142-00002,"The Vasudhāradhāraṇī, dedicated to Vasudhārā, the bodhisattva of wealth, prosperity, and abundance (who has a strong following among the Newar Buddhists of the Kathmandu valley), is taught by the Buddha in Kauśāmbī to the rich merchant and layman Sucandra. He has been reduced to poverty and so requests a sermon from the Lord so that he may provide for his own family and so that all beings may become prosperous. This scripture includes a dhāraṇī along with enumerations of benefits and ritual instructions for use. Although more recent, this fragment of the Vasudhāradhāraṇī in Nepālākṣarā characters was inserted between the wooden covers of Or. 142.1."," The Vasudhāradhāraṇī, dedicated to Vasudhārā, the bodhisattva of wealth, prosperity, and abundance (who has a strong following",Vasudhārādhāraṇī,,,Vasudhārādhāraṇī,"Vasudhāraṇī,Vasudhārādhāraṇīsūtra",https://cudl.lib.cam.ac.uk/iiif/MS-OR-00142-00002,palm_leaf,,,1000132,Nepāl.,nepālākṣarā,san,"4,5","26,5",2,"2,8"
MS-ADD-01704,"A palm-leaf manuscript of the Catuḥpīṭhatantra, Jñānavārāsekaprakriyā.","A palm-leaf manuscript of the Catuḥpīṭhatantra, Jñānavārāsekaprakriyā.","Catuḥpīṭhatantra, Jñānavārāsekaprakriyā",,,,,https://cudl.lib.cam.ac.uk/iiif/MS-ADD-01704,palm_leaf,,,,,nepālākṣarā,san,4,31,,
MS-ADD-01538,A paper manuscript of the Vīrakuśāvadāna.,A paper manuscript of the Vīrakuśāvadāna.,Vīrakuśāvadāna,,,,,https://cudl.lib.cam.ac.uk/iiif/MS-ADD-01538,paper,,,1000132,Nepal.,nepālākṣarā,san,9,36,,
MS-ADD-01276,A paper manuscript of the Pāpaparimocana with a Newari translation.,A paper manuscript of the Pāpaparimocana with a Newari translation.,Pāpaparimocana,,,,,https://cudl.lib.cam.ac.uk/iiif/MS-ADD-01276,paper,1801,1900,1000132,Nepal.,nepālākṣarā,san,9,"19,5",,
MS-ADD-01577,"A polychrome charm (yantra) against lightning made of seven intertwined letters (kūṭākṣara, monogram script): ya, ra, va, la, ma, kṣa and ha. The verso bears a four-line stanza in the sragdharā metre (with caesurae marked by a small dot), listing each letter and explaining its symbolism (for the Sanskrit text, see Transcription): ""The letter ya is what we call the air, ra is fire, va is water: the circle we call earth is the letter la, on it ma is what is called Mount Meru, above the latter is kṣa, which has the nature of the means to wisdom; from ha, the sky, is the spotless purity that is emptiness. This seven-letter diagram is [such a] group: bow incessantly to this excellent one that wards off the fall of thunderbolt!""","A polychrome charm (yantra) against lightning made of seven intertwined letters (kūṭākṣara, monogram script): ya, ra, va,",Saptākṣarī Vajrapātādyahārī,,,,,https://cudl.lib.cam.ac.uk/iiif/MS-ADD-01577,nep_multi_layered_paper,1801,1900,1000132,Nepal.,devanāgarī,san,"37,5","26,5",8,
MS-ADD-01679-00005,A palm-leaf manuscript of an Avadāna.,A palm-leaf manuscript of an Avadāna.,Avadāna,,,,,https://cudl.lib.cam.ac.uk/iiif/MS-ADD-01679-00005,palm_leaf,,,,,nepālākṣarā,san,5,30,,
MS-ADD-01546-00001,"This small-size illuminated black-paper manuscript, written in gold ink, contains the Pañcabuddhadhāraṇī, dedicated to the five Buddhas (Vairocana, Akṣobhya, Ratnasambhava, Amitābha and Amoghasiddhi).","This small-size illuminated black-paper manuscript, written in gold ink, contains the Pañcabuddhadhāraṇī, dedicated to the",Pañcabuddhadhāraṇī,,,,,https://cudl.lib.cam.ac.uk/iiif/MS-ADD-01546-00001,black_paper,1601,1800,1000132,Nepāl.,nepālākṣarā,san,6,"15,1","3,5",13
MS-ADD-01277,"An illuminated black-paper manuscript of the Aparimitāyurdhāraṇīsūtra, a popular text containig the spell of Aparimitāyus. It is taught by the Buddha to Mañjuśrī in Śrāvastī. Those who recite, copy or worship this text are granted longevity and will be reborn in Aparimitāyus’ buddha-field."," An illuminated black-paper manuscript of the Aparimitāyurdhāraṇīsūtra, a popular text containig the spell of Aparimitāyus.",Aparimitāyurdhāraṇīsūtra,,,Aparimitāyurdhāraṇīsūtra,"Aparimitāyurdhāraṇīmahāyānasūtraratnarāja,Aparimitāyurnāmadhāraṇīmahāyānasūtra,Aparimitāyurnāmadhāraṇī",https://cudl.lib.cam.ac.uk/iiif/MS-ADD-01277,black_paper,1600,1799,1000132,Nepal.,rañjanā,san,"6,7","15,5","4,4","11,5"
MS-ADD-01598,A paper manuscript of the Avadānasārasamuccaya.,A paper manuscript of the Avadānasārasamuccaya.,Avadānasārasamuccaya,,,,,https://cudl.lib.cam.ac.uk/iiif/MS-ADD-01598,paper,,,,,devanāgarī,san,,,,
MS-ADD-01465,A palm-leaf manuscript of the Aṣṭasāhasrikā Prajñāpāramitā.,A palm-leaf manuscript of the Aṣṭasāhasrikā Prajñāpāramitā.,Aṣṭasāhasrikā Prajñāpāramitā,K12,,,,https://cudl.lib.cam.ac.uk/iiif/MS-ADD-01465,palm_leaf,,,1000132,Nepal.,nepālākṣarā,san,6,33,,
MS-ADD-01697-00003,A paper manuscript of a Work on Ritual.,A paper manuscript of a Work on Ritual.,Work on Ritual@en,,,,,https://cudl.lib.cam.ac.uk/iiif/MS-ADD-01697-00003,palm_leaf,,,,,nepālākṣarā,san,5,30,,
MS-ADD-01380-01381,"A modern manuscript containing the Kauśīdyavīryotsāhanāvadāna and the Snātāvadāna. In Bendall's catalogue (1883) this manuscript is described under two different classmarks, Add.1380 (Snātāvadāna) and Add.1381 ( Kauśighavīryotsāhanāvadāna(!) ), as if it were two distinct manuscripts. However, many common features points to the fact that they are two parts of one single manuscript (paper, folio dimensions, layout and script are identical in the two). Moreover, in Add.1381 the foliation ends with 11, while in Add.1380 it begins with 12 (and not 11, as stated in Bendall 1883: 80). These two avadānas belong to the cycle of king Aśoka and the monk Upagupta, and are versified versions from the Ratnāvadānamālā. In the edition by Takahata (1954), the frame story of the Kauśīdyavīryotsāhanāvadāna consists of only four stanzas and is different from the one found in the present manuscript. His edition is based mainly on a manuscript kept in the Kyōto University Library, but in the critical apparatus he states that the longer version in nine stanzas is witnessed in four other manuscripts used by him (it is also present in a manuscript microfilmed by the Nepal-German Manuscripts Preservation Project [NGMCP] with reel No. A 117-9, acc. No. NAK 3/596, and the title Avadānaratnamālā). Parallel versions of the stories can be found in other collections, like the Avadānaśataka (II.3, Snātāvadāna; I.3, Kuśīdāvadāna). The title Kauśighavīryotsāhanāvadāna(!) given in the manuscript is wrong due to trivial scribal errors (i instead of ī, and the common misreading of gha for dya, two akṣaras very similar in Nepalese scripts).",A modern manuscript containing the Kauśīdyavīryotsāhanāvadāna and the Snātāvadāna. In Bendall's catalogue (1883) this manuscript,"Kauśīdyavīryotsāhanāvadāna, Snātāvadāna",,,Kauśīdyavīryotsāhanāvadāna,,https://cudl.lib.cam.ac.uk/iiif/MS-ADD-01380-01381,nep_multi_layered_paper,1701,1900,1000132,Nepal.,nepālākṣarā,,13,"34,7","7,8",27
MS-ADD-01164-00003,"These three paper folios contain the Nairātmāguhyeśvarīmantradhāraṇī, a ritualistic text dedicated to the tantric goddess Nairātmā-Guhyeśvarī. It consists of a longer hṛdayamantra (heart-mantra) followed by a section with a description of the deity herself and further spells.","These three paper folios contain the Nairātmāguhyeśvarīmantradhāraṇī, a ritualistic text dedicated to the tantric goddess",Nairātmāguhyeśvarīmantradhāraṇī,,,,,https://cudl.lib.cam.ac.uk/iiif/MS-ADD-01164-00003,paper,1801,1850,1000132,Nepal.,nepālākṣarā,san,8,32,6,29
MS-ADD-01708-00002,A palm-leaf manuscript of a Commentary on the Nāmasaṅgīti.,A palm-leaf manuscript of a Commentary on the Nāmasaṅgīti.,Commentary on the Nāmasaṅgīti@en,,W22003,,,https://cudl.lib.cam.ac.uk/iiif/MS-ADD-01708-00002,palm_leaf,,,,,nepālākṣarā,san,5,31,,
MS-OR-00131-00004,Three palm-leaf folios of the Prasenajitaparipṛcchā.,Three palm-leaf folios of the Prasenajitaparipṛcchā.,Prasenajitaparipṛcchā,,,,,https://cudl.lib.cam.ac.uk/iiif/MS-OR-00131-00004,palm_leaf,,,1000132,Nepal.,nepālākṣarā,san,,,,
MS-ADD-01464,"A palm-leaf manuscripts containing Rāhulabhadra 's Prajñāpāramitāstotra and the Aṣṭasāhasrikā Prajñāpāramitā. The 'Perfection of Wisdom in Eight Thousand Lines' (Aṣṭasāhasrikā Prajñāpāramitā) is one of the earliest Mahāyāna scriptures. This foundational sūtra of Mahāyāna Buddhism developed gradually over a period of about two hundred years, from the first century BCE to the first century CE (some of its earliest recensions were translated into Chinese during the Han dynasty, 206 BC – 220 CE). There is still no scholarly consensus as to the provenance of the text, but the most widespread view is that it was probably written in central or southern India. The 'Perfection of Wisdom in Eight Thousand Lines' presents its doctrine in the form of a dialogue between the Buddha and one of his disciples, the arhat Subhūti. In this dialogue ""the principal ontological message (message concerning what ultimately exists) […] is an extension of the Buddhist teaching of not-Self to equal no essential unchanging core, therefore no fundamentally real existence, as applied to all things without exception"" (Williams 2009; 52). This sūtra belongs to the early stratum of the so-called 'Perfection of Wisdom (prajñāpāramitā) literature,' subsequently expanded between the second and fourth centuries CE into other huge scriptures, for instance the 'Perfection of Wisdom in One Hundred Thousand Lines' (the Śatasāhasrikāprajñāpāramitā). The 'Perfection of Wisdom in Eight Thousand Stanzas' enjoyed a central role in the Buddhist cult of the book, and particularly in Newar Buddhism. This palm-leaf manuscript belongs to the Pāla tradition of illuminated manuscripts of the Aṣṭasāhasrikā Prajñāpāramitā in the ornamental Pāla script. The manuscript originally had six illuminated folios, each with three miniatures, but unfortunately the original first folio is missing. It has been replaced with a later palm-leaf folio without miniatures and in a different script. The date of the manuscript is controversial since in the colophon it is stated that it was copied in the fifth regnal year of the Pāla king Mahīpāla, but without specifying which of the two Pāla kings named Mahīpāla is meant. The fifth year of either is equivalent to c. 985 or after ca 1070, and since Mahīpāla II most probably reigned only for three years, the earliest date is more probable. The donor, a woman named Lāḍokā , is mentioned in the colophon. The manuscript is protected by two extremely beautiful painted wooden covers, both bearing traces of materials smeared during worship rites.",A palm-leaf manuscripts containing Rāhulabhadra 's Prajñāpāramitāstotra and the Aṣṭasāhasrikā Prajñāpāramitā. The 'Perfection,"Prajñāpāramitāstotra, Aṣṭasāhasrikā Prajñāpāramitā",K12,,Prajñāpāramitāstotra,"Nirvikalpastuti,Nirvikalpastava,Prajñāpāramitādevyā Ekaviṃśatistotra,Prajñāpāramitaikaviṃśatistotra,Shes rab kyi pha rol tu phyin pa'i bstod pa,Rnam par mi rtog pa'i bstod pa",https://cudl.lib.cam.ac.uk/iiif/MS-ADD-01464,corypha_palm_leaf,,,,,,,"5,4","53,4",,
MS-ADD-01546-00002,"This small-size black-paper manuscript containing the Mahāsaṃvarahṛdayadhāraṇī has the peculiarity of being written in inks of three different colours: gold, bronze and silver.",This small-size black-paper manuscript containing the Mahāsaṃvarahṛdayadhāraṇī has the peculiarity of being written in inks,Mahāsaṃvarahṛdayadhāraṇī,,,,,https://cudl.lib.cam.ac.uk/iiif/MS-ADD-01546-00002,black_paper,1601,1800,1000132,Nepāl.,nepālākṣarā,san,"6,3","15,5","3,5",12
MS-OR-00131-00002,A palm-leaf folio containing the end of the Āryasāgaranāgarājaparipṛcchasūtra and the beginning of an unidentified work.,A palm-leaf folio containing the end of the Āryasāgaranāgarājaparipṛcchasūtra and the beginning of an unidentified work.,Āryasāgaranāgarājaparipṛcchasūtra,,,,,https://cudl.lib.cam.ac.uk/iiif/MS-OR-00131-00002,palm_leaf,,,1000132,Nepal.,nepālākṣarā,,,,,
MS-ADD-01473,A paper manuscript of the Śaśajātakāvadāna.,A paper manuscript of the Śaśajātakāvadāna.,Śaśajātakāvadāna,,,,,https://cudl.lib.cam.ac.uk/iiif/MS-ADD-01473,paper,1801,1900,1000132,Nepal.,devanāgarī,san,11,25,,
MS-ADD-02192,"A 15th-century manuscript of the Cāndravyākaraṇa of the Buddhist grammarian Candragomin (probably 5th c. CE) with its most widespread and best known commentary, the Cāndravyākaraṇavṛtti, for a long time believed to be the work of Candragomin himself, but now generally attributed to an author called Dharmadāsa who probably flourished in the 6th c. CE, but of whom nothing else is known (Dash 1986; Oberlies 1989). The manuscript contains the whole of chapter 1 and part of chapter 2. The text stops abruptly at the end of f. 113r, in the middle of the commentary on sūtra 2.3.37, gaurādibhyaḥ, as if the copyist was interrupted and never had the chance to complete the task. Folio 113v was left blank, although two verses, probably of a devotional or apotropaic nature, were later added by a different hand. This manuscript is among those used by Bruno Liebich for his 1902 edition of the sūtrapāṭha.",A 15th-century manuscript of the Cāndravyākaraṇa of the Buddhist grammarian Candragomin (probably 5th c. CE) with its most,Cāndravyākaraṇavṛtti,,,Cāndravyākaraṇavṛtti,Cāndravṛtti,https://cudl.lib.cam.ac.uk/iiif/MS-ADD-02192,palm_leaf,1201,1300,1000132,Nepal,,san,5,"30,5",,"2,5"
MS-ADD-01680-00003-00004,A palm-leaf manuscript of the Divyāvadāna.,A palm-leaf manuscript of the Divyāvadāna.,Divyāvadāna,,,,,https://cudl.lib.cam.ac.uk/iiif/MS-ADD-01680-00003-00004,palm_leaf,,,,,nepālākṣarā,san,5,32,,
MS-ADD-01701-00002,A palm-leaf manuscript of the Dharmasaṅgraha.,A palm-leaf manuscript of the Dharmasaṅgraha.,Dharmasaṅgraha,,,,,https://cudl.lib.cam.ac.uk/iiif/MS-ADD-01701-00002,palm_leaf,,,,,nepālākṣarā,san,5,30,,
MS-ADD-01343,"This Nepalese paper manuscript contains the Saptavāra, the Mañjuśrīnāmasaṅgīti and the Daśabalastavastotra. The Saptavāra ‘Seven Days’ usually incorporates the Vasudhārā (substituted in this manuscript by the Vasundhārānāmāṣṭottaraśataka), Vajravidāraṇā, Gaṇapatihṛdayā, Uṣṇīṣavijayā, Parṇaśavarī/Prajñāpāramitā, Mārīcī, and Grahamātṛkā. This collection associates each dhāraṇī with a specific day of the week, a tradition going back to at least the sixteenth century in Nepal. The Mañjuśrīnāmasaṅgīti is a popular Buddhist tantric work, which consists primarily of 162 verses associated with Mañjuśrī, the Bodhisattva of wisdom. The Daśabalastavastotra is a Buddhist hymn to the ten powers of an illuminated being. According to the colophon placed at the end of the Mañjuśrīnāmasaṅgīti, the manuscript was written in Kathmandu (Kāṣṭhamaṇḍapa), probably in the Tarumūla Mahāvihāra (written taramūdra), in 1663 CE, under the reign of Jayapratāpa Malla (1641-1674), and it was commissioned by a monk named Ratnasiṃha ."," This Nepalese paper manuscript contains the Saptavāra, the Mañjuśrīnāmasaṅgīti and the Daśabalastavastotra. The Saptavāra","Saptavāra, Mañjuśrīnāmasaṅgīti, Daśabalastavastotra",,,,,https://cudl.lib.cam.ac.uk/iiif/MS-ADD-01343,paper,,,1083294,"Kathmandu (Kāṣṭhamaṇḍapa),",,,"7,2","18,2",,
MS-OR-00715-00002,"This fragmentary palm-leaf manuscript is part of a bundle of a few manuscripts (Or.715), all seemingly composed of collections of Buddhist stotras. Five different manuscripts, all from around the 12th-13th century, have been tentatively identified on paleographical and codicological grounds. Further research might shed more light on the subdivision of the whole manuscript bundle."," This fragmentary palm-leaf manuscript is part of a bundle of a few manuscripts (Or.715), all seemingly composed of collections",Buddhist Stotras@en,,,,,https://cudl.lib.cam.ac.uk/iiif/MS-OR-00715-00002,palm_leaf,,,1000132,Nepal.,nepālākṣarā,san,"4,3","27,2","2,5",7
MS-ADD-01404,"An 18th-century manuscript of the little-known Vajrasūcikopaniṣad (also known under the title Vajrasūcyupaniṣad). This short text, of unknown date, is often ascribed to the famous Vedāntin Śaṅkara , and it is also vaguely related to the Sāmaveda. The version of the text transmitted in the manuscript is quite different from the one printed in the standard edition of 108 Upaniṣads by L.S. Panshikar (no. 38; p. 222-23). It is in three parts: the first part (in prose and verse) deals with the definition of a real brahmin (brāhmaṇa), and was sometimes read as a critique of the caste system; the second part (in prose and verse) considers various notions of liberation (mokṣa); the third part (prose only) deals with the interpretation of the upaniṣadic “Great Sayings” (mahāvākyas). The printed text of the Upaniṣad corresponds, with important textual variations, to the prose portion of the first part only, found here on ff. 1v1-3v4.",An 18th-century manuscript of the little-known Vajrasūcikopaniṣad (also known under the title Vajrasūcyupaniṣad). This short,Vajrasūcikopaniṣad,,,Vajrasūcikopaniṣad,Vajrasūcyupaniṣad,https://cudl.lib.cam.ac.uk/iiif/MS-ADD-01404,paper,1781,1782,,,,san,"10,5","18,1","6,8","13,3"
MS-ADD-01278,"This Nepalese paper manuscript, dated 1866 CE, contains a Tantric Buddhist text called Sarvadurgatipariśodhanasamādhi, , belonging to the Sarvadurgatipariśodhana cycle. Most of the textual material of the present work is included in the so-called Version B of the Sarvadurgatipariśodhanatantra (see Skorupski 1983: xviii), where it susbtitues the 'Basic Tantra' (consisting of the description of the ritual maṇḍala). In the present text, the rite for the elimination of all evil destinies, aimed at procuring a better rebirth for the dead and a a better life for the living, is described in its different elements (for instance, the various mantras, the visualization of maṇḍalas, the transference of merits, the vow for the development of the supreme Enlightment-mind, Skt. bodhicitta etc.). This manuscript seems to give particular importance to the hand-gestures (mudrās) to be perfomed during the rite, which are carefully depicted in numerous polychrome illustrations throughout the book. As in the case of many other ritual texts from Nepal, the manuscript is an accordion book (or concertina), the ideal format to be read and consulted during the performance of often complex ritual practices. Possibly, the colophon recorded also the name of the owner of this manuscript, which has subsequently been erased (probably due to some change of ownership).","This Nepalese paper manuscript, dated 1866 CE, contains a Tantric Buddhist text called Sarvadurgatipariśodhanasamādhi, ,",Sarvadurgatipariśodhanasamādhi,,,Sarvadurgatipariśodhanasamādhi,"Ādiyogasamādhi,Sarvadurgatipariśodhanatantra",https://cudl.lib.cam.ac.uk/iiif/MS-ADD-01278,nep_multi_layered_paper,,,1000132,Nepal.,nepālākṣarā,san,8,17,"5,3","13,5"
