0,1,2,3,4,5,6,7,8,9,10,11,12,13,14,15,16,17,18,19
rid,abstractText,abstractShort,title,rkts ID,isAbout,mainTitle,altTitle,manifestUrl,material_support,origNotBefore,origNotAfter,origPlaceKey,origPlaceName,script,lang,paperDimHeight,paperDimWidth,textDimHeight,textDimWidth
MS-ADD-01691-00003,"This Nepalese palm-leaf manuscript from the 15th century contains a tantric initiation manual called Abhiṣekavidhi, which describes the rituals to be performed at various stages of the consecration procedure (carefully marked with a final rubric for each subsection). This manual is apparently an excerpt from the Vajrāvalī of Abhayākaragupta, a long and complex work on tantric rituals.","This Nepalese palm-leaf manuscript from the 15th century contains a tantric initiation manual called Abhiṣekavidhi, which",Abhiṣekavidhi,,,,,https://cudl.lib.cam.ac.uk/iiif/MS-ADD-01691-00003,palm_leaf,,,1000132,Nepal.,,san,"5,2","31,5","3,5","27,5"
MS-ADD-01706-00008,A palm-leaf manuscript of the Lakṣaṇa.,A palm-leaf manuscript of the Lakṣaṇa.,Lakṣaṇa,,,,,https://cudl.lib.cam.ac.uk/iiif/MS-ADD-01706-00008,palm_leaf,,,,,nepālākṣarā,san,,,,
MS-ADD-01411,A paper manuscript of the .,A paper manuscript of the .,Bhadrakalpāvadāna,,,,,https://cudl.lib.cam.ac.uk/iiif/MS-ADD-01411,paper,,,,,nepālākṣarā,san,10,43,,
MS-OR-02258,"The Pañcarakṣā corpus (""Five Protections"") consists of the Mahāpratisarā, Mahāmāyūrī, Mahāsāhasrapramardanī, Mahāmantrānusāriṇī, and Mahāśītavatī. The earliest evidence for texts grouped together as the ""Five Great Dhāraṇīs"" comes from Tibetan catalogues around 800 CE, but this compendium is somewhat different from the surviving Sanskrit collection, which is preserved in manuscripts dating back to the eleventh century. These scriptures include spells, enumerations of benefits and ritual instructions for use. With the course of time all of them became deified and five related goddesses emerged. It is, however, important to note that the texts themselves do not have any references to these goddesses. According to the colophon, this beautifully illuminated manuscript was written with golden ink on indigo-dyed paper in1695 CE, during the shared reign of three kings, Jitāmitramalla (in the manuscript called Jitāmṛtamalla), Ugramalla and Bhūpatīndramalla (in the manuscript called Indrapratīndramalla). The manuscript was commissioned as an object of worship, probably by a group of Buddhist monks. The first one named is Śrīdevamuni , who seemed to be the major donor; another monk named is Śrījñāna , from the Jetavanamahāvihāra in Bhaktapur (however according to Locke (1985: 462) this vihāra is situated in the village of Thimi near Bhaktapur). Even if commissioned by monks living in Bhaktapur, the manuscript has been written in Kathmandu (the then capital of an independent, separate kingdom)."," The Pañcarakṣā corpus (""Five Protections"") consists of the Mahāpratisarā, Mahāmāyūrī, Mahāsāhasrapramardanī, Mahāmantrānusāriṇī,",Pañcarakṣā,T1946,,,,https://cudl.lib.cam.ac.uk/iiif/MS-OR-02258,nep_multi_layered_paper,,,1083263,Bhaktapur.,,san,"10,4","39,2","5,5",32
MS-OR-00728-00003,One of several palm-leaf fragments collected in one bundle under the classmark Or.728. A note on the paper sleeve identifies it as the beginning of the Ādikarmapradīpa.,One of several palm-leaf fragments collected in one bundle under the classmark Or.728. A note on the paper sleeve identifies,Ādikarmapradīpa,,,,,https://cudl.lib.cam.ac.uk/iiif/MS-OR-00728-00003,palm_leaf,,,1000132,Nepal.,nepālākṣarā,san,,,,
MS-ADD-01586,A paper manuscript of the Rāṣṭrapālaparipṛcchā.,A paper manuscript of the Rāṣṭrapālaparipṛcchā.,Rāṣṭrapālaparipṛcchā,,,,,https://cudl.lib.cam.ac.uk/iiif/MS-ADD-01586,paper,,,,,nepālākṣarā,san,9,37,,
MS-ADD-02199,A palm-leaf manuscript of an Unidentified Collection.,A palm-leaf manuscript of an Unidentified Collection.,Unidentified Collection@en,,,,,https://cudl.lib.cam.ac.uk/iiif/MS-ADD-02199,palm_leaf,,,,,nepālākṣarā,san,"5,4","28,2",,
MS-ADD-01691-00002,"A certain Rāṇaṭhaku commmissioned this Nepalese palm-leaf manuscript from the second half of the 12th century. The exact date is now illegible. Dr. D. Wright read it as Nepāla 299, but, as argued by Petech (1984: 64), this seems to be impossible because the date would fall outside the reign of Ānandadeva (1099-1167), the king supposedly mentioned in the colophon, although the portion with his name is now almost completely broken off. Moreover, the date read by Dr. D. Wright cannot be verified, while it might be verified for the following days: Saturday, October 8th, 1149; October 4th, 1152; October 20th, 1156; October 17th, 1158; November 5th, 1166. The manuscript contains a Buddhist text called Kurukullākalpa, a ritual manual dedicated to the tantric goddess Kurukullā. The work is divided into a few chapters with various ritual instructions, including obtaining supernatural powers (siddhi). This manuscript was used in the critical edition done by the 84000 project in 2011.",A certain Rāṇaṭhaku commmissioned this Nepalese palm-leaf manuscript from the second half of the 12th century. The exact,Kurukullākalpa,,,,,https://cudl.lib.cam.ac.uk/iiif/MS-ADD-01691-00002,palm_leaf,1149,1166,1000132,Nepal.,,san,"4,5",32,"2,8","9,5"
MS-ADD-01164-00001,"The Pañcarakṣā corpus (""Five Protections"") consists of the Mahāpratisarā, Mahāmāyūrī, Mahāsāhasrapramardanī, Mahāmantrānusāriṇī, and Mahāśītavatī. The earliest evidence for texts grouped together as the ""Five Great Dhāraṇīs"" comes from Tibetan catalogues around 800 CE, but this compendium is somewhat different from the surviving Sanskrit collection, which is preserved in manuscripts dating back to the eleventh century. These scriptures include spells, enumerations of benefits and ritual instructions for use. With the course of time all of them became deified and five related goddesses emerged. It is, however, important to note that the texts themselves do not have any references to these goddesses. This illuminated paper manuscript in an ornate script is probably to be dated to the 17th century."," The Pañcarakṣā corpus (""Five Protections"") consists of the Mahāpratisarā, Mahāmāyūrī, Mahāsāhasrapramardanī, Mahāmantrānusāriṇī,",Pañcarakṣā,T1946,,,,https://cudl.lib.cam.ac.uk/iiif/MS-ADD-01164-00001,nep_multi_layered_paper,1601,1700,1000132,Nepāl.,,san,9,34,"5,3","28,5"
MS-OR-00715-00001,"This fragmentary palm-leaf manuscript is part of a bundle of a few manuscripts (Or.715), all seemingly composed of collections of Buddhist stotras. Five different manuscripts, all from around the 12th-13th century, have been tentatively identified on paleographical and codicological grounds. Further research might shed more light on the subdivision of the whole manuscript bundle. A surviving colophon refers to the Avalokiteśvarasya Nāmāṣṭaśataka."," This fragmentary palm-leaf manuscript is part of a bundle of a few manuscripts (Or.715), all seemingly composed of collections",Āryāvalokiteśvarasya Nāmāṣṭaśatakam,,,Āryāvalokiteśvarasya Nāmāṣṭaśatakam,"Sarvajinadhāturatnakaraṇḍaka nāma Bhagavato
                                Āryāvalokiteśvarasya Nāmāṣṭaśatakam",https://cudl.lib.cam.ac.uk/iiif/MS-OR-00715-00001,palm_leaf,1101,1300,1000132,Nepal.,nepālākṣarā,san,"4,3","27,2","2,5",7
MS-OR-00130,"The Pañcarakṣā corpus (""Five Protections"") consists of the Mahāpratisarā, Mahāmāyūrī, Mahāsāhasrapramardanī, Mahāmantrānusāriṇī, and Mahāśītavatī. The earliest evidence for texts grouped together as the ""Five Great Dhāraṇīs"" comes from Tibetan catalogues around 800 CE, but this compendium is somewhat different from the surviving Sanskrit collection, which is preserved in manuscripts dating back to the eleventh century. These scriptures include spells, enumerations of benefits and ritual instructions for use. With the course of time all of them became deified and five related goddesses emerged. It is, however, important to note that the texts themselves do not have any references to these goddesses. This manuscript consists of just a fragment of the last folio, and of original wooden covers bearing extremly refined illuminations with episodes of Buddhist religious history. However, the two covers most probably belonged to another manuscript, since the distance between the two string holes is ca. 14 cm in the fragment and 18 cm in the covers. According to the colophon, the manuscript was written 275 Nepāla Saṃvat, i.e. 1155 CE, in the Hnogal Tol in Pātan (śrīlalitabrumāyāṃ śrīhnāgalaṭolke in the manuscript) (""Hnogal Tol is the same as the Nogalasthāna [...] in the Sundhara(!) ward in Patan"", Petech 1984: 62). After the colophon, a note in Newarī language and Nepālākṣarā script has been added by a previous owner of the manuscript, with the date 812 Nepāla Saṃvat, i.e. 1692 CE, given in the bhūtasaṅkhyā system (samvat netram eka mātrikā)."," The Pañcarakṣā corpus (""Five Protections"") consists of the Mahāpratisarā, Mahāmāyūrī, Mahāsāhasrapramardanī, Mahāmantrānusāriṇī,",Pañcarakṣā,T1946,,,,https://cudl.lib.cam.ac.uk/iiif/MS-OR-00130,palm_leaf,,,1000132,Nepāl,,san,"5,7","42,7","1,5","1,5"
MS-OR-00728-00008,One of several palm-leaf fragments collected in one bundle under the classmark Or.728. A single-folio fragment of the Bodhicaryāvatāra (end of chapter 6 and beginnig of chapter 7)..,One of several palm-leaf fragments collected in one bundle under the classmark Or.728. A single-folio fragment of the Bodhicaryāvatāra,Bodhicaryāvatāra,T3216,,,,https://cudl.lib.cam.ac.uk/iiif/MS-OR-00728-00008,palm_leaf,,,1000132,Nepal.,nepālākṣarā,san,,,,
MS-ADD-01326,"The Dhāraṇīsaṅgraha, or Dhāraṇīmantrasaṃgraha, 'Dhāraṇī(-mantra) Collection’ includes hundreds of dhāraṇīs, ""connected with all the chief personages of the Buddhist Pantheon, as well as with some of the chief literary works: e.g. the 'Lotus' and the Laṅkāvatāra (Bendall 1883: 49)"". This important Buddhist text remains unedited. This beautifully illuminated paper manuscript from Nepāl is dated to 1719 CE, and has been written in the Tarumūla Mahāvihāra in Kathmandu by a Buddhist scribe named Patideva, during the reign of Jayamahendrasiṃha Malla (1714-1722). It was commissioned by a Buddhist monk named Trailokara (who belonged to the Bhāskadeva Saṃskārita Śrīkeśavacandrakṛtapārāvatamahāvihāra), and his wife Pūrṇṇāvatī , probably represented with their family in the illumination on folio 223 verso (the members of the family are mentioned in the colophon)."," The Dhāraṇīsaṅgraha, or Dhāraṇīmantrasaṃgraha, 'Dhāraṇī(-mantra) Collection’ includes hundreds of dhāraṇīs, ""connected with",Dhāraṇīsaṅgraha,,,Dhāraṇīsaṅgraha,Dhāraṇīmantrasaṃgraha,https://cudl.lib.cam.ac.uk/iiif/MS-ADD-01326,nep_multi_layered_paper,,,1000132,Nepal,nepālākṣarā,san,10,"39,7","5,5",34
MS-OR-00157-00002,Three palm-leaf folios of the Saṃskṛtāsaṃskṛtaviniścaya.,Three palm-leaf folios of the Saṃskṛtāsaṃskṛtaviniścaya.,Saṃskṛtāsaṃskṛtaviniścaya,T3242,,,,https://cudl.lib.cam.ac.uk/iiif/MS-OR-00157-00002,palm_leaf,,,1000132,Nepal.,nepālākṣarā,san,,,,
MS-ADD-01680-00003-00001,"A palm-leaf fragment from the Divyāvadāna, ""Glorious Deeds"", a collection of Buddhist tales very popular in Medieval and Early Modern Nepal. In the final stage of its redaction, this anonymous compilation consisted of 38 avadānas. It has been edited by E.B. Cowell and R.A. Neil in 1884, mainly on the basis of modern Nepalese paper manuscripts (they give a collation of the variants in the present manuscript in Appendix B, see Cowell and Neil 1884: 660-663). However, many scholars have stressed the heterogeneous character of the stories included in the Divyāvadāna: for instance, 21 stories have a more or less literal parallel in the Mūlasarvāstivādavinaya (see Panglung 1981: XV), while the 38th tale in Cowell and Neil's edition, the Maitrakanyakāvadāna, is now attributed to Gopadatta (see Hahn: 1992, passim and Klaus 1983: 5 ff.). The 11 folios of this manuscript contains the last part of the Pūrṇāvadāna (corresponding to the second story in Cowell's and Neil's edition, from p. 42, line 9 to p. 54, line 17)."," A palm-leaf fragment from the Divyāvadāna, ""Glorious Deeds"", a collection of Buddhist tales very popular in Medieval and",Divyāvadāna,,,Divyāvadāna,Divyāvadānamālā,https://cudl.lib.cam.ac.uk/iiif/MS-ADD-01680-00003-00001,corypha_palm_leaf,,,1000132,Nepal.,nepālākṣarā,san,5,32,"2,5","2,5"
MS-ADD-01680-00002-00004,"The Avadānaśataka is an ancient collection of Buddhist legends, its first redaction dating to the first centuries of the CE. It was translated into Chinese and Tibetan during the first millennium CE, gaining large popularity across Asia. This Nepalese incomplete palm-leaf manuscript consists of one single folio (numbered 2) containing part of the Guḍaśālāvadāna, the forty-first story in the collection. This folio is part of a bundle of nine folios possibly from four different manuscripts, containing parts of five stories from the Avadānaśataka. They were used by Speyer for his edition of the Avadānaśataka and were given the siglum F. A complete diplomatic transcription of this fragment is provided in the section ""View more options."""," The Avadānaśataka is an ancient collection of Buddhist legends, its first redaction dating to the first centuries of the",Avadānaśataka,,,Avadānaśataka,Śatakāvadāna,https://cudl.lib.cam.ac.uk/iiif/MS-ADD-01680-00002-00004,corypha_palm_leaf,1301,1500,1000132,Nepal.,nepālākṣarā,san,5,32,,
MS-ADD-01267,A palm-leaf manuscript of the Kāraṇḍavyūha.,A palm-leaf manuscript of the Kāraṇḍavyūha.,Kāraṇḍavyūha,,,Kāraṇḍavyūha,"Kāraṇḍavyūhamahāyānasūtraratnarāja,Āryakāraṇḍavyūhamahāyānasūtraratnarāja",https://cudl.lib.cam.ac.uk/iiif/MS-ADD-01267,palm_leaf,1301,1500,1000132,Nepal.,nepālākṣarā,san,5,31,,
MS-ADD-01611,"The Avadānaśataka is an ancient collection of Buddhist legends, its first redaction dating to the first centuries of the CE. It was translated into Chinese and Tibetan during the first millennium CE, gaining large popularity across Asia. This Nepalese manuscript, dated 1645 CE, is the one on which J. Speyer based his editio princeps of 1902. Older fragmentary palm leaf manuscripts have survived, but this is the oldest complete source for the reconstruction of the text."," The Avadānaśataka is an ancient collection of Buddhist legends, its first redaction dating to the first centuries of the",Avadānaśataka,,,Avadānaśataka,Śatakāvadāna,https://cudl.lib.cam.ac.uk/iiif/MS-ADD-01611,paper,,,1000132,Nepal.,,san,,,,
MS-ADD-01534,A paper manuscript of the Meghasūtra.,A paper manuscript of the Meghasūtra.,Meghasūtra,,,,,https://cudl.lib.cam.ac.uk/iiif/MS-ADD-01534,paper,,,1000132,Nepal.,nepālākṣarā,san,"7,5",22,,
MS-ADD-02196-00002,A palm-leaf manuscript of a Dhāraṇi.,A palm-leaf manuscript of a Dhāraṇi.,Dhāraṇi,,,,,https://cudl.lib.cam.ac.uk/iiif/MS-ADD-02196-00002,palm_leaf,,,,,nepālākṣarā,san,4,55,,
MS-ADD-01680-00014-00002,"A palm-leaf fragment containing an unidentified Buddhist Tantric text. The manuscript contains a list of various mantras, and with short explanations about their visualization, probably taken from different sources (see below in the Explicit)."," A palm-leaf fragment containing an unidentified Buddhist Tantric text. The manuscript contains a list of various mantras,",Buddhist Tantric Fragment@en,,,,,https://cudl.lib.cam.ac.uk/iiif/MS-ADD-01680-00014-00002,corypha_palm_leaf,,,1000132,Nepal.,nepālākṣarā,san,"4,3",28,"1,5","1,7"
MS-ADD-01476-00001,"This beautifully illuminated multi-text manuscript is written on black paper in golden ink. It was completed in 1791 CE in Kathmandu in a vihāra called Hemākra and commisioned by a Vajrācārya named ‏Abhayananda (written Abhayanandra in the colophon). The manuscript contains the follwing Buddhist texts: the Pañcarakṣā (only the dhāraṇī part), the Abhayakarīdhāraṇī (recorded as Abhayakalidhāraṇī in the colophon), the Tārābhaṭṭārikāṣṭottaraśataka and the Mahākālamantradhāna (strangely added after the colophon). The Pañcarakṣā ""Five Protections"" consists of the Mahāpratisarā, Mahāmāyūrī, Mahāsāhasrapramardanī, Mahāmantrānusāriṇī, and Mahāśītavatī. The earliest evidence for texts grouped together as the ""Five Great Dhāraṇīs"" comes from Tibetan catalogues around 800 CE, but this compendium is somewhat different from the surviving Sanskrit collection, which is preserved in manuscripts dating back to the eleventh century. These scriptures include spells, enumerations of benefits and ritual instructions for use. With the course of time all of them became deified and five related goddesses emerged. It is, however, important to note that the texts themselves do not have any references to these goddesses. The other texts are little known and yet unpublished.",This beautifully illuminated multi-text manuscript is written on black paper in golden ink. It was completed in 1791 CE,"Pañcarakṣā, Abhayakarīdhāraṇī, Tārābhaṭṭārikāṣṭottaraśataka, Mahākālamantradhāna",,,,,https://cudl.lib.cam.ac.uk/iiif/MS-ADD-01476-00001,nep_multi_layered_paper,,,1083294,Kathmandu (Suvarṇapanāri; see Locke 1985: 497 fn 4).,nepālākṣarā,,8,"23,3","5,5","20,7"
MS-ADD-01536,A paper manuscript of the Laghusvayambhūpurāṇa.,A paper manuscript of the Laghusvayambhūpurāṇa.,Laghusvayambhūpurāṇa,,,,,https://cudl.lib.cam.ac.uk/iiif/MS-ADD-01536,paper,,,1000132,Nepal.,nepālākṣarā,san,8,23,,
MS-ADD-01544,A palm-leaf manuscript of the Aṣṭasāhasrikā Prajñāpāramitā.,A palm-leaf manuscript of the Aṣṭasāhasrikā Prajñāpāramitā.,Aṣṭasāhasrikā Prajñāpāramitā,K12,,,,https://cudl.lib.cam.ac.uk/iiif/MS-ADD-01544,palm_leaf,1101,1200,1000132,Nepal.,nepālākṣarā,san,5,51,,
MS-ADD-01646,"This Nepalese palm-leaf manuscript, written during the reign of the king Abhayamalla (1216-1235), contains Kuladatta's (ca. 12th c.) commentary on the Kriyāsaṃgraha, a Buddhist ritual manual. This is one of the manuscripts used by Tanemura in his 2004 critical edition of selected chapters of this work.","This Nepalese palm-leaf manuscript, written during the reign of the king Abhayamalla (1216-1235), contains Kuladatta's (ca.",Kriyāsaṃgrahapañjikā,,,,,https://cudl.lib.cam.ac.uk/iiif/MS-ADD-01646,palm_leaf,1216,1235,1000132,Nepal.,nepālākṣarā,san,"4,5",31,3,27
MS-ADD-01697-00007,"A palm-leaf manuscript of the Cakrasambaradaṇḍakāstuti, Stotra.","A palm-leaf manuscript of the Cakrasambaradaṇḍakāstuti, Stotra.","Cakrasambaradaṇḍakāstuti, Stotra",,,,,https://cudl.lib.cam.ac.uk/iiif/MS-ADD-01697-00007,palm_leaf,,,,,nepālākṣarā,san,5,31,,
MS-OR-00722-00005,"A single palm-leaf folio of un unidentified work. This fragment seems to contain the beginning of a Buddhist text, as the initial invocation reads ""oṃ namo bhagavate ārye prajñe"" in Nepālākṣara, in a rather coarse hand. The recto is blank, except for an almost illegible line in what seems to be Bengali script in a much more refined hand.","A single palm-leaf folio of un unidentified work. This fragment seems to contain the beginning of a Buddhist text, as the",Unidentified Fragment@en,,,,,https://cudl.lib.cam.ac.uk/iiif/MS-OR-00722-00005,palm_leaf,,,,,nepālākṣarā,san,,,,
MS-ADD-01706-00007,A palm-leaf manuscript of a Work on Measurements.,A palm-leaf manuscript of a Work on Measurements.,Work on Measurements@en,,,,,https://cudl.lib.cam.ac.uk/iiif/MS-ADD-01706-00007,palm_leaf,,,,,nepālākṣarā,san,5,20,,
MS-OR-00155,A palm-leaf manuscript of the Chātrakumāradatta's Commentary on the Cakrasaṃvaratantra.,A palm-leaf manuscript of the Chātrakumāradatta's Commentary on the Cakrasaṃvaratantra.,Commentary on the Cakrasaṃvaratantra@en,,T626,,,https://cudl.lib.cam.ac.uk/iiif/MS-OR-00155,palm_leaf,,,1000132,Nepal.,nepālākṣarā,san,,,,
MS-ADD-01660-00002,"An incomplete copy of the Cāndravyākaraṇa by the Buddhist grammarian Candragomin, containing the sūtrapāṭha without any commentary. Previously, it had been wrongly identified as Śabdalakṣaṇa. The manuscript includes the pratyāhārasūtras and part of the first section of the first chapter up to rule 1.1.146, jvalādibhyo ṇo vā, and the beginning of the next rule."," An incomplete copy of the Cāndravyākaraṇa by the Buddhist grammarian Candragomin, containing the sūtrapāṭha without any",Cāndravyākaraṇa,,,,,https://cudl.lib.cam.ac.uk/iiif/MS-ADD-01660-00002,palm_leaf,1400,1499,1000132,Nepal.,nepālākṣarā,san,"4,4",33,"2,8","29,7"
MS-ADD-01679-00004,A palm-leaf manuscript of the Work on the Mātṛs.,A palm-leaf manuscript of the Work on the Mātṛs.,Work on the Mātṛs@en,,,,,https://cudl.lib.cam.ac.uk/iiif/MS-ADD-01679-00004,palm_leaf,,,,,nepālākṣarā,san,5,30,,
MS-ADD-01683,A palm-leaf manuscript of the Saddharmapuṇḍarīka.,A palm-leaf manuscript of the Saddharmapuṇḍarīka.,Saddharmapuṇḍarīka,K113,,,,https://cudl.lib.cam.ac.uk/iiif/MS-ADD-01683,palm_leaf,,,,,nepālākṣarā,san,5,30,,
MS-ADD-01487,A paper manuscript of the Upoṣadavratakathā (Aṣṭamīvratavidhāna).,A paper manuscript of the Upoṣadavratakathā (Aṣṭamīvratavidhāna).,Upoṣadavratakathā,,,Upoṣadavratakathā,Aṣṭamīvratavidhāna,https://cudl.lib.cam.ac.uk/iiif/MS-ADD-01487,paper,,,1000132,Nepal.,nepālākṣarā,san,8,26,,
MS-ADD-01680-00004,A palm-leaf manuscript of the Maṇicuḍāvadāna.,A palm-leaf manuscript of the Maṇicuḍāvadāna.,Maṇicuḍāvadāna,,,,,https://cudl.lib.cam.ac.uk/iiif/MS-ADD-01680-00004,palm_leaf,,,,,nepālākṣarā,san,5,32,,
MS-ADD-01697-00004,"A palm-leaf manuscript of the Balimālikā, Dhāraṇī, Vajrayoginīpranāmaikaviṃśatikādhāraṇī.","A palm-leaf manuscript of the Balimālikā, Dhāraṇī, Vajrayoginīpranāmaikaviṃśatikādhāraṇī.","Balimālikā, Dhāraṇī, Vajrayoginīpranāmaikaviṃśatikādhāraṇī",,,,,https://cudl.lib.cam.ac.uk/iiif/MS-ADD-01697-00004,palm_leaf,,,,,nepālākṣarā,san,5,30,,
MS-OR-00724,A paper manuscript of the Buddhist fragment.,A paper manuscript of the Buddhist fragment.,Buddhist fragment@en,,,,,https://cudl.lib.cam.ac.uk/iiif/MS-OR-00724,palm_leaf,,,,,nepālākṣarā,san,,,,
MS-ADD-01478,A paper manuscript of the Śikṣāsamuccaya.,A paper manuscript of the Śikṣāsamuccaya.,Śikṣāsamuccaya,T3281,,,,https://cudl.lib.cam.ac.uk/iiif/MS-ADD-01478,paper,1301,1500,,,bengali,san,5,34,,
MS-OR-00158-00001,"A palm-leaf manuscript of the Vajrāmṛtatantra, one of the main Yoginītantras, which until now was known only through the Tibetan translation of the lo tsā ba Gyi jo zla ba’i ’od zer (10th-11th cent.) and through the indirect tradition. To date, only few verses of this tantra could have been read in the original Sanskrit. Although certainly less influential than other Yoginītantras, such as, in primis, the Hevajratantra, the Vajrāmṛtamahātantra must have enjoyed a certain popularity. For instance, it is referred to as one of the authoritative sources for the practice of the bāhyahoma by Bhūvācārya (early 11th cent. ?), the author of the Saṃvarodayā nāma Maṇḍalopāyikā, in the bāhyādhyātmahomavidhiḥ, the eleventh chapter of his work. In addition, we should point out that this tantra has been commented at least three times. Two of the commentaries are extant in the original Sanskrit but are still unpublished. Originally, Or.158 was formed of palm leaves from two independent manuscripts, both fragmentary, one containing the Vajrāmṛtatantra and one containing the Buddhakapālatantra, another yoginītantra, so far published only in part (Luo 2010). Since the ductus, the quality and the shape of the leaves comprising these two works is the same (each leaf contains six lines, one string-hole dividing the writing area into two pseudocolumns, of which the left one is smaller than the right one, and on average 64/65 akṣaras), it is likely that at some point someone got confused and mistakenly put together leaves from these two works according to an apparently correct numerical sequence. The folios of the two works have been now rearranged into two distinct bundles (Or.158.1 and Or.158.2), each containing the extant folios of each work. It is highly plausible that together with these two works, a third one, namely the Vajrāralimahātantrarāja, made originally part of the same collection. The clue for this is given by the short list of titles added by a different hand on the top left side of folio 1r. If this was the case, Or.158 could be considered to be a originally a composite and multi-text manuscript. On the right of the same recto we find some mantras written likely by the same hand (it is possible that the last two lines are instead written by a third hand; see under Additions).","A palm-leaf manuscript of the Vajrāmṛtatantra, one of the main Yoginītantras, which until now was known only through the",Vajrāmṛtatantra,,,Vajrāmṛtatantra,Vajrāmṛtamahātantra,https://cudl.lib.cam.ac.uk/iiif/MS-OR-00158-00001,corypha_palm_leaf,,,1000132,Nepal.,,san,5,31,,"1,8"
MS-OR-00717,A partial palm-leaf manuscript of an unidentified Buddhist stotra.,A partial palm-leaf manuscript of an unidentified Buddhist stotra.,Buddhist stotra@en,,,,,https://cudl.lib.cam.ac.uk/iiif/MS-OR-00717,palm_leaf,,,1000132,Nepal.,nepālākṣarā,san,,,,
